A1: 深圳市2022年服务“双区”建设专项招录公务员职位表
A2: 职位编码 | B2: 招录名额 | C2: 报考人数 | D2: 报录比 | E2: 职位类型 | F2: 招考单位 | G2: 录用职位名称 | H2: 职位级别 | I2: 人员类别 | J2: 职位简述 | K2: 性别 | L2: 最高年龄 | M2: 身份要求 | N2: 学历要求 | O2: 学位要求 | P2: 研究生专业要求 | Q2: 本科专业要求 | R2: 是否要求2年以上基层工作经历 | S2: 其它条件 | T2: 是否开展心理素质测评 | U2: 笔试科目 | V2: 备注
A3: 202201FA001 | B3: 9 | C3: 300 | D3: =C3/B3 -> 33.333333333333336 | E3: 急需紧缺专业职位（专业综合职位组） | F3: 深圳市发展和改革委员会 | G3: 审计专业职位组 | H3: 二级主任科员及以下 | I3: 公务员 | J3: 从事财政财务审计、预算执行审计等工作。 | K3: 不限 | L3: 35 | M3: 不限 | N3: 大学本科及以上 | O3: 学士及以上 | P3: 审计硕士（专业硕士）(A020218),会计学(A120201),会计硕士（专业硕士）(A120206) | Q3: 会计学(B120203),审计学(B120207) | R3: 否 | S3: 无 | T3: 否 | U3: 《行政职业能力测验》,《申论》（Ⅰ类）,《审计素质测试》。
A4: 202201FA002 | E4: 急需紧缺专业职位（专业综合职位组） | F4: 深圳市福田区审计局 | G4: 审计专业职位组 | H4: 二级主任科员及以下 | I4: 公务员 | J4: 从事财政财务审计、预算执行审计等工作。 | K4: 不限 | L4: 35 | M4: 不限 | N4: 大学本科及以上 | O4: 学士及以上 | P4: 审计硕士（专业硕士）(A020218),会计学(A120201),会计硕士（专业硕士）(A120206) | Q4: 会计学(B120203),审计学(B120207) | R4: 否 | S4: 无 | T4: 是 | U4: 《行政职业能力测验》,《申论》（Ⅰ类）,《审计素质测试》。
A5: 202201FA003 | E5: 急需紧缺专业职位（专业综合职位组） | F5: 深圳市福田区基建审计办公室 | G5: 审计专业职位组 | H5: 二级主任科员及以下 | I5: 参照公务员法管理人员 | J5: 从事财政财务审计、预算执行审计等工作。 | K5: 不限 | L5: 35 | M5: 不限 | N5: 大学本科及以上 | O5: 学士及以上 | P5: 审计硕士（专业硕士）(A020218),会计学(A120201),会计硕士（专业硕士）(A120206) | Q5: 会计学(B120203),审计学(B120207) | R5: 否 | S5: 无 | T5: 是 | U5: 《行政职业能力测验》,《申论》（Ⅰ类）,《审计素质测试》。
A6: 202201FA004 | E6: 急需紧缺专业职位（专业综合职位组） | F6: 深圳市盐田区固定资产投资审计办公室 | G6: 审计专业职位组 | H6: 二级主任科员及以下 | I6: 参照公务员法管理人员 | J6: 从事财政财务审计、预算执行审计等工作。 | K6: 不限 | L6: 35 | M6: 不限 | N6: 大学本科及以上 | O6: 学士及以上 | P6: 审计硕士（专业硕士）(A020218),会计学(A120201),会计硕士（专业硕士）(A120206) | Q6: 会计学(B120203),审计学(B120207) | R6: 否 | S6: 无 | T6: 否 | U6: 《行政职业能力测验》,《申论》（Ⅰ类）,《审计素质测试》。
A7: 202201FA005 | E7: 急需紧缺专业职位（专业综合职位组） | F7: 深圳市宝安区沙井街道办事处 | G7: 审计专业职位组 | H7: 二级主任科员及以下 | I7: 公务员 | J7: 从事财政财务审计、预算执行审计等工作。 | K7: 不限 | L7: 35 | M7: 不限 | N7: 大学本科及以上 | O7: 学士及以上 | P7: 审计硕士（专业硕士）(A020218),会计学(A120201),会计硕士（专业硕士）(A120206) | Q7: 会计学(B120203),审计学(B120207) | R7: 否 | S7: 无 | T7: 否 | U7: 《行政职业能力测验》,《申论》（Ⅰ类）,《审计素质测试》。
A8: 202201FB001 | E8: 急需紧缺专业职位（专业综合职位组） | F8: 深圳市社会保险基金管理局 | G8: 审计专业职位组 | H8: 二级主办及以下 | I8: 参照公务员法管理人员 | J8: 从事财政财务审计、预算执行审计等工作。录用后安排在下属基层单位工作。 | K8: 不限 | L8: 35 | M8: 不限 | N8: 大学本科及以上 | O8: 学士及以上 | P8: 审计硕士（专业硕士）(A020218),会计学(A120201),会计硕士（专业硕士）(A120206) | Q8: 会计学(B120203),审计学(B120207) | R8: 否 | S8: 无 | T8: 是 | U8: 《行政职业能力测验》,《申论》（Ⅰ类）,《审计素质测试》。
A9: 202201FB002 | E9: 急需紧缺专业职位（专业综合职位组） | F9: 深圳市市场监督管理局南山监管局 | G9: 审计专业职位组 | H9: 二级主办及以下 | I9: 公务员 | J9: 从事财政财务审计、预算执行审计等工作。 | K9: 不限 | L9: 35 | M9: 不限 | N9: 大学本科及以上 | O9: 学士及以上 | P9: 审计硕士（专业硕士）(A020218),会计学(A120201),会计硕士（专业硕士）(A120206) | Q9: 会计学(B120203),审计学(B120207) | R9: 否 | S9: 无 | T9: 否 | U9: 《行政职业能力测验》,《申论》（Ⅰ类）,《审计素质测试》。
A10: 202201FB003 | E10: 急需紧缺专业职位（专业综合职位组） | F10: 深圳市医疗保险基金管理中心（参公） | G10: 审计专业职位组 | H10: 二级主办及以下 | I10: 参照公务员法管理人员 | J10: 从事财政财务审计、预算执行审计等工作。 | K10: 不限 | L10: 35 | M10: 不限 | N10: 大学本科及以上 | O10: 学士及以上 | P10: 审计硕士（专业硕士）(A020218),会计学(A120201),会计硕士（专业硕士）(A120206) | Q10: 会计学(B120203),审计学(B120207) | R10: 否 | S10: 无 | T10: 否 | U10: 《行政职业能力测验》,《申论》（Ⅰ类）,《审计素质测试》。
A11: 202201HF001 | B11: 1 | C11: 71 | D11: =C11/B11 -> 71 | E11: 市区机关职位 | F11: 深圳市审计局 | G11: 财务会计审计 | H11: 二级主任科员及以下 | I11: 公务员 | J11: 从事重大经济政策落实情况、市级各部门预算执行和其他财政收支、市属国企和金融机构、社保基金等审计工作。 | K11: 不限 | L11: 35 | M11: 不限 | N11: 硕士研究生及以上 | O11: 硕士及以上 | P11: 财政学（含∶税收学）(A020203),金融学（含∶保险学）(A020204),产业经济学(A020205),国际贸易学(A020206),数量经济学(A020209),金融硕士（专业硕士）(A020212),税务硕士（专业硕士）(A020214),保险硕士（专业硕士）(A020216),审计硕士（专业硕士）(A020218),会计学(A120201),会计硕士（专业硕士）(A120206) | R11: 是 | S11: 无 | T11: 否 | U11: 《行政职业能力测验》,《申论》（Ⅰ类）,《审计素质测试》。
A12: 202201HF003 | B12: 1 | C12: 55 | D12: =C12/B12 -> 55 | E12: 市区机关职位 | F12: 中国共产党深圳市南山区纪律检查委员会 | G12: 纪检监察 | H12: 一级科员 | I12: 公务员 | J12: 从事审查调查、依法调查处置和依纪依法监督工作。 | K12: 不限 | L12: 35 | M12: 不限 | N12: 大学本科及以上 | O12: 学士及以上 | P12: 审计硕士（专业硕士）(A020218),会计学(A120201),会计硕士（专业硕士）(A120206) | Q12: 会计学(B120203),审计学(B120207) | R12: 否 | S12: 具有注册会计师或会计专业技术资格（中级以上）或审计专业技术资格（中级以上）。 | T12: 是 | U12: 《行政职业能力测验》,《申论》（Ⅰ类）,《审计素质测试》。
A13: 202201HG009 | B13: 1 | C13: 83 | D13: =C13/B13 -> 83 | E13: 市区机关职位 | F13: 深圳市宝安区水务局 | G13: 工程财务会计 | H13: 一级科员 | I13: 公务员 | J13: 从事水务工程会计核算、财务审计、预决算编制管理等工作。 | K13: 不限 | L13: 35 | M13: 不限 | N13: 大学本科及以上 | O13: 学士及以上 | P13: 财政学（含∶税收学）(A020203),税务硕士（专业硕士）(A020214),审计硕士（专业硕士）(A020218),会计学(A120201),会计硕士（专业硕士）(A120206) | Q13: 财政学类(B0202),会计学(B120203),审计学(B120207) | R13: 否 | S13: 具有会计专业初级以上专业技术资格证书。 | T13: 否 | U13: 《行政职业能力测验》,《申论》（Ⅰ类）,《财务会计素质测试》。
A14: 202201HG010 | B14: 1 | C14: 61 | D14: =C14/B14 -> 61 | E14: 市区机关职位 | F14: 深圳市宝安区国有资产监督管理局 | G14: 财务会计审计 | H14: 四级主任科员 | I14: 公务员 | J14: 从事财务管理、会计核算、财务审计、预决算编制管理、固定资产管理等工作。 | K14: 不限 | L14: 35 | M14: 不限 | N14: 硕士研究生及以上 | O14: 硕士及以上 | P14: 财政学（含∶税收学）(A020203),金融学（含∶保险学）(A020204),金融硕士（专业硕士）(A020212),税务硕士（专业硕士）(A020214),审计硕士（专业硕士）(A020218),会计学(A120201),会计硕士（专业硕士）(A120206) | R14: 否 | S14: 具有会计专业初级以上专业技术资格证书。 | T14: 否 | U14: 《行政职业能力测验》,《申论》（Ⅰ类）,《财务会计素质测试》。
A15: 202201HL023 | B15: 1 | C15: 21 | D15: =C15/B15 -> 21 | E15: 市区机关职位 | F15: 深圳市劳动人事争议仲裁院 | G15: 劳动人事争议仲裁 | H15: 二级主任科员及以下 | I15: 参照公务员法管理人员 | J15: 从事劳动人事争议仲裁调解等工作。 | K15: 不限 | L15: 35 | M15: 不限 | N15: 大学本科及以上 | O15: 学士及以上 | P15: 民商法学（含：劳动法学、社会保障法学）(A030105),诉讼法学(A030106) | Q15: 法学(B030101) | R15: 是 | S15: 符合《劳动争议调解仲裁法》第20条规定且通过法律职业资格考试（国家司法考试）并取得A类证书。 | T15: 是 | U15: 《行政职业能力测验》,《申论》（Ⅰ类）。 | V15: 专业要求为诉讼法学(A030106)的，仅限民事诉讼方向。
A16: 202201HL031 | B16: 1 | C16: 190 | D16: =C16/B16 -> 190 | E16: 市区机关职位 | F16: 深圳市统计局 | G16: 行政综合 | H16: 四级主任科员及以下 | I16: 公务员 | J16: 从事行政事务、人事党务、纪检监察、综合调研等工作。 | K16: 不限 | L16: 35 | M16: 不限 | N16: 大学本科及以上 | O16: 学士及以上 | P16: 法学(A0301),中国语言文学(A0501),工商管理(A1202) | Q16: 法学类(B0301),中国语言文学类(B0501),工商管理类(B1202) | R16: 否 | S16: 无 | T16: 否 | U16: 《行政职业能力测验》,《申论》（Ⅰ类）。
A17: 202201HL032 | B17: 1 | C17: 526 | D17: =C17/B17 -> 526 | E17: 市区机关职位 | F17: 深圳市统计局 | G17: 统计分析 | H17: 四级主任科员及以下 | I17: 公务员 | J17: 从事统计报表管理、调查分析与数量研究工作。 | K17: 不限 | L17: 35 | M17: 不限 | N17: 大学本科及以上 | O17: 学士及以上 | P17: 应用经济学(A0202) | Q17: 经济学类(B0201),财政学类(B0202),金融学类(B0203),经济与贸易类(B0204),统计学类(B0711) | R17: 否 | S17: 无 | T17: 否 | U17: 《行政职业能力测验》,《申论》（Ⅰ类）。
A18: 202201HL037 | B18: 1 | C18: 196 | D18: =C18/B18 -> 196 | E18: 市区机关职位 | F18: 深圳市乡村振兴和协作交流局 | G18: 乡村振兴综合管理 | H18: 二级主任科员及以下 | I18: 公务员 | J18: 从事乡村振兴领域综合管理、调研等工作。 | K18: 不限 | L18: 35 | M18: 不限 | N18: 硕士研究生及以上 | O18: 硕士及以上 | P18: 应用经济学(A0202),社会学(A0303),城乡规划学(A0833),农业管理(A0908),农村发展(A0909),管理科学与工程(A1201),农林经济管理(A1203) | R18: 否 | S18: 无 | T18: 否 | U18: 《行政职业能力测验》,《申论》（Ⅰ类）。
A19: 202201HL050 | B19: 1 | C19: 101 | D19: =C19/B19 -> 101 | E19: 市区机关职位 | F19: 深圳市罗湖区人民检察院 | G19: 检察官助理 | H19: 五级检察官助理 | I19: 公务员 | J19: 从事检察相关业务工作。 | K19: 不限 | L19: 35 | M19: 不限 | N19: 大学本科及以上 | O19: 学士及以上 | P19: 法学(A0301) | Q19: 法学类(B0301) | R19: 否 | S19: 通过法律职业资格考试（国家司法考试）并取得A类证书。 | T19: 否 | U19: 《行政职业能力测验》,《申论》（Ⅰ类）。
A20: 202201HL060 | B20: 1 | C20: 49 | D20: =C20/B20 -> 49 | E20: 市区机关职位 | F20: 深圳市光明区人民检察院 | G20: 检察官助理 | H20: 五级检察官助理 | I20: 公务员 | J20: 从事检察相关业务工作。 | K20: 女 | L20: 35 | M20: 不限 | N20: 大学本科及以上 | O20: 学士及以上 | P20: 刑法学(A030104),民商法学（含：劳动法学、社会保障法学）(A030105) | Q20: 法学类(B0301) | R20: 否 | S20: 通过法律职业资格考试（国家司法考试）并取得A类证书。 | T20: 否 | U20: 《行政职业能力测验》,《申论》（Ⅰ类）。 | V20: 专业要求为民商法学（A030105）的，仅限知识产权方向。
A21: 202201HL064 | B21: 1 | C21: 271 | D21: =C21/B21 -> 271 | E21: 市区机关职位 | F21: 深圳市福田区人民法院 | G21: 行政综合 | H21: 一级科员 | I21: 公务员 | J21: 从事行政事务、人事党务、纪检监察、综合调研等工作。 | K21: 女 | L21: 35 | M21: 不限 | N21: 大学本科及以上 | O21: 学士及以上 | P21: 法学(A0301),工商管理(A1202) | Q21: 法学类(B0301),工商管理类(B1202) | R21: 否 | S21: 无 | T21: 否 | U21: 《行政职业能力测验》,《申论》（Ⅰ类）。
A22: 202201HL069 | B22: 1 | C22: 38 | D22: =C22/B22 -> 38 | E22: 市区机关职位 | F22: 深圳市盐田区人民法院 | G22: 法官助理 | H22: 五级法官助理 | I22: 公务员 | J22: 从事审判辅助工作。 | K22: 女 | L22: 35 | M22: 不限 | N22: 大学本科及以上 | O22: 学士及以上 | P22: 宪法学与行政法学(A030103),刑法学(A030104) | Q22: 法学类(B0301) | R22: 否 | S22: 通过法律职业资格考试（国家司法考试）并取得A类证书。 | T22: 否 | U22: 《行政职业能力测验》,《申论》（Ⅰ类）。
A23: 202201HL095 | B23: 1 | C23: 175 | D23: =C23/B23 -> 175 | E23: 市区机关职位 | F23: 中共深圳市福田区委办公室 | G23: 行政综合 | H23: 一级科员 | I23: 公务员 | J23: 从事综合材料起草、综合协调等工作。 | K23: 不限 | L23: 35 | M23: 不限 | N23: 大学本科及以上 | O23: 学士及以上 | P23: 应用经济学(A0202),法学(A0301),中国语言文学(A0501),公共管理(A1204) | Q23: 经济学类(B0201),金融学类(B0203),法学类(B0301),中国语言文学类(B0501),公共管理类(B1204) | R23: 否 | S23: 无 | T23: 是 | U23: 《行政职业能力测验》,《申论》（Ⅰ类）。
A24: 202201HL097 | B24: 2 | C24: 131 | D24: =C24/B24 -> 65.5 | E24: 市区机关职位 | F24: 中共深圳市福田区委政法委员会 | G24: 行政综合 | H24: 一级科员 | I24: 公务员 | J24: 从事行政事务、人事党务、纪检监察、综合调研等工作。 | K24: 不限 | L24: 35 | M24: 不限 | N24: 大学本科及以上 | O24: 学士及以上 | P24: 法学(A0301),中国语言文学(A0501) | Q24: 法学类(B0301),中国语言文学类(B0501) | R24: 否 | S24: 无 | T24: 是 | U24: 《行政职业能力测验》,《申论》（Ⅰ类）。
A25: 202201HL101 | B25: 1 | C25: 41 | D25: =C25/B25 -> 41 | E25: 市区机关职位 | F25: 深圳市福田区住房和建设局 | G25: 法律事务 | H25: 四级主任科员及以下 | I25: 公务员 | J25: 从事法律法规研究、开展依法行政等工作。 | K25: 不限 | L25: 35 | M25: 不限 | N25: 大学本科及以上 | O25: 学士及以上 | P25: 法学理论(A030101),宪法学与行政法学(A030103),民商法学（含：劳动法学、社会保障法学）(A030105),诉讼法学(A030106),经济法学(A030107),法律硕士（专业硕士）(A030111) | Q25: 法学(B030101) | R25: 否 | S25: 无 | T25: 是 | U25: 《行政职业能力测验》,《申论》（Ⅰ类）。
A26: 202201HL103 | B26: 1 | C26: 137 | D26: =C26/B26 -> 137 | E26: 市区机关职位 | F26: 深圳市福田区住房和建设局 | G26: 行政综合 | H26: 一级科员 | I26: 公务员 | J26: 从事行政事务、人事党务、纪检监察、综合调研等工作。 | K26: 不限 | L26: 35 | M26: 不限 | N26: 大学本科及以上 | O26: 学士及以上 | P26: 经济学(A02),法学(A0301),政治学(A0302),社会学(A0303),中国语言文学(A0501),新闻传播学(A0503),公共管理(A1204) | Q26: 经济学类(B0201),法学类(B0301),政治学类(B0302),社会学类(B0303),中国语言文学类(B0501),新闻传播学类(B0503),公共管理类(B1204) | R26: 否 | S26: 无 | T26: 是 | U26: 《行政职业能力测验》,《申论》（Ⅰ类）。
A27: 202201HL109 | B27: 1 | C27: 42 | D27: =C27/B27 -> 42 | E27: 市区机关职位 | F27: 深圳市福田区政务服务数据管理局 | G27: 文字综合 | H27: 一级科员 | I27: 公务员 | J27: 从事文字材料撰写、综合材料起草等工作。 | K27: 不限 | L27: 35 | M27: 不限 | N27: 大学本科及以上 | O27: 学士及以上 | P27: 法学(A0301),中国语言文学(A0501),新闻传播学(A0503) | Q27: 法学类(B0301),中国语言文学类(B0501),新闻传播学类(B0503) | R27: 否 | S27: 无 | T27: 是 | U27: 《行政职业能力测验》,《申论》（Ⅰ类）。
A28: 202201HL116 | B28: 1 | C28: 125 | D28: =C28/B28 -> 125 | E28: 市区机关职位 | F28: 深圳市罗湖区民政局 | G28: 行政综合 | H28: 一级科员 | I28: 公务员 | J28: 从事行政事务、人事党务、综合调研等工作。 | K28: 不限 | L28: 35 | M28: 不限 | N28: 大学本科及以上 | O28: 学士及以上 | P28: 理论经济学(A0201),法学(A0301),政治学(A0302),社会学(A0303),中国语言文学(A0501),新闻传播学(A0503) | Q28: 经济学类(B0201),法学类(B0301),政治学类(B0302),社会学类(B0303),中国语言文学类(B0501),新闻传播学类(B0503) | R28: 否 | S28: 无 | T28: 是 | U28: 《行政职业能力测验》,《申论》（Ⅰ类）。
A29: 202201HL136 | B29: 1 | C29: 160 | D29: =C29/B29 -> 160 | E29: 市区机关职位 | F29: 深圳市南山区工业和信息化局 | G29: 区域产业规划发展 | H29: 二级主任科员及以下 | I29: 公务员 | J29: 从事区域合作、产业规划发展等相关工作。 | K29: 不限 | L29: 35 | M29: 不限 | N29: 硕士研究生及以上 | O29: 硕士及以上 | P29: 经济学(A02) | R29: 否 | S29: 无 | T29: 是 | U29: 《行政职业能力测验》,《申论》（Ⅰ类）。
A30: 202201HL140 | B30: 1 | C30: 25 | D30: =C30/B30 -> 25 | E30: 市区机关职位 | F30: 深圳市南山区城市更新和土地整备局 | G30: 法律事务 | H30: 一级科员 | I30: 公务员 | J30: 从事法律法规研究、开展依法行政等工作。 | K30: 不限 | L30: 35 | M30: 不限 | N30: 大学本科及以上 | O30: 学士及以上 | P30: 法学(A0301) | Q30: 法学类(B0301) | R30: 否 | S30: 通过法律职业资格考试（国家司法考试）并取得A类证书。 | T30: 是 | U30: 《行政职业能力测验》,《申论》（Ⅰ类）。
A31: 202201HL152 | B31: 1 | C31: 43 | D31: =C31/B31 -> 43 | E31: 市区机关职位 | F31: 中共深圳市宝安区委政法委员会 | G31: 综治督导 | H31: 一级科员 | I31: 公务员 | J31: 从事社会治安防控、电信网络诈骗等经济违法犯罪防控工作。 | K31: 不限 | L31: 35 | M31: 不限 | N31: 大学本科及以上 | O31: 学士及以上 | P31: 法学(A0301) | Q31: 法学类(B0301) | R31: 否 | S31: 中共党员。 | T31: 否 | U31: 《行政职业能力测验》,《申论》（Ⅰ类）。
A32: 202201HL153 | B32: 1 | C32: 16 | D32: =C32/B32 -> 16 | E32: 市区机关职位 | F32: 深圳市宝安区网格综合管理办公室 | G32: 党建综合 | H32: 一级科员 | I32: 参照公务员法管理人员 | J32: 从事行政事务、人事党务、纪检监察、综合调研等工作。 | K32: 不限 | L32: 35 | M32: 不限 | N32: 大学本科及以上 | O32: 学士及以上 | P32: 法学(A0301),中国语言文学(A0501) | Q32: 法学类(B0301),中国语言文学类(B0501) | R32: 否 | S32: 中共党员。 | T32: 否 | U32: 《行政职业能力测验》,《申论》（Ⅰ类）。
A33: 202201HL156 | B33: 1 | C33: 22 | D33: =C33/B33 -> 22 | E33: 市区机关职位 | F33: 深圳市宝安区司法局 | G33: 大湾区法律研究 | H33: 一级科员 | I33: 公务员 | J33: 从事研究大湾区内不同法律体系的对接工作，需熟悉英美法系与大陆法系。 | K33: 不限 | L33: 35 | M33: 不限 | N33: 大学本科及以上 | O33: 学士及以上 | P33: 法学(A0301) | Q33: 法学类(B0301) | R33: 否 | S33: 雅思6.5分及以上，或托福90分及以上，或GRE(含作文)达到310分及以上，或GMAT达到600分及以上，或英语专业八级考试达到60分及以上，或大学英语六级考试达到550分及以上。 | T33: 否 | U33: 《行政职业能力测验》,《申论》（Ⅰ类）。
A34: 202201HL170 | B34: 1 | C34: 43 | D34: =C34/B34 -> 43 | E34: 市区机关职位 | F34: 深圳市龙岗区司法局 | G34: 法律事务 | H34: 一级科员 | I34: 公务员 | J34: 从事依法治区、行政执法监督等工作。 | K34: 不限 | L34: 35 | M34: 不限 | N34: 大学本科及以上 | O34: 学士及以上 | P34: 法学(A0301) | Q34: 法学类(B0301) | R34: 否 | S34: 通过法律职业资格考试（国家司法考试）并取得A类证书。 | T34: 否 | U34: 《行政职业能力测验》,《申论》（Ⅰ类）。
A35: 202201HL172 | B35: 1 | C35: 37 | D35: =C35/B35 -> 37 | E35: 市区机关职位 | F35: 深圳市龙岗区退役军人事务局 | G35: 行政综合 | H35: 一级科员 | I35: 公务员 | J35: 从事行政事务、人事党务、纪检监察、综合调研等工作。 | K35: 不限 | L35: 35 | M35: 不限 | N35: 大学本科及以上 | O35: 学士及以上 | P35: 哲学(A0101),法学(A0301),中国语言文学(A0501),新闻传播学(A0503) | Q35: 哲学类(B0101),法学类(B0301),中国语言文学类(B0501),新闻传播学类(B0503) | R35: 否 | S35: 无 | T35: 否 | U35: 《行政职业能力测验》,《申论》（Ⅰ类）。
A36: 202201HL175 | B36: 1 | C36: 34 | D36: =C36/B36 -> 34 | E36: 市区机关职位 | F36: 深圳市龙岗区应急管理局 | G36: 行政综合 | H36: 一级科员 | I36: 公务员 | J36: 从事行政事务、人事党务、纪检监察、综合调研、宣传等工作。 | K36: 不限 | L36: 35 | M36: 不限 | N36: 大学本科及以上 | O36: 学士及以上 | P36: 法学(A0301),中国语言文学(A0501),新闻传播学(A0503) | Q36: 法学类(B0301),中国语言文学类(B0501),新闻传播学类(B0503) | R36: 否 | S36: 无 | T36: 否 | U36: 《行政职业能力测验》,《申论》（Ⅰ类）。
A37: 202201HL176 | B37: 3 | C37: 406 | D37: =C37/B37 -> 135.33333333333334 | E37: 市区机关职位 | F37: 中共深圳市龙华区委办公室 | G37: 文字综合 | H37: 四级主任科员 | I37: 公务员 | J37: 从事综合材料撰写工作。 | K37: 不限 | L37: 35 | M37: 不限 | N37: 硕士研究生及以上 | O37: 硕士及以上 | P37: 应用经济学(A0202),中国语言文学(A0501),外国语言文学(A0502),新闻传播学(A0503),工商管理(A1202) | R37: 否 | S37: 无 | T37: 是 | U37: 《行政职业能力测验》,《申论》（Ⅰ类）。
A38: 202201HL178 | B38: 1 | C38: 211 | D38: =C38/B38 -> 211 | E38: 市区机关职位 | F38: 深圳市龙华区工业和信息化局 | G38: 经济运行分析 | H38: 四级主任科员及以下 | I38: 公务员 | J38: 从事经济运行分析、产业发展规划等工作。 | K38: 不限 | L38: 35 | M38: 不限 | N38: 大学本科及以上 | O38: 学士及以上 | P38: 应用经济学(A0202),工商管理(A1202) | Q38: 经济学类(B0201),工商管理类(B1202) | R38: 否 | S38: 无 | T38: 是 | U38: 《行政职业能力测验》,《申论》（Ⅰ类）。
A39: 202201HL189 | B39: 1 | C39: 202 | D39: =C39/B39 -> 202 | E39: 市区机关职位 | F39: 深圳市坪山区人力资源局 | G39: 人力资源管理 | H39: 一级科员 | I39: 公务员 | J39: 从事人力资源管理等工作。 | K39: 不限 | L39: 35 | M39: 不限 | N39: 大学本科及以上 | O39: 学士及以上 | P39: 法学(A0301),政治学(A0302),社会学(A0303),工商管理(A1202),公共管理(A1204) | Q39: 法学类(B0301),政治学类(B0302),社会学类(B0303),工商管理类(B1202),公共管理类(B1204) | R39: 否 | S39: 无 | T39: 否 | U39: 《行政职业能力测验》,《申论》（Ⅰ类）。
A40: 202201HL190 | B40: 1 | C40: 373 | D40: =C40/B40 -> 373 | E40: 市区机关职位 | F40: 深圳市坪山区国有资产监督管理局 | G40: 国有资产监管 | H40: 一级科员 | I40: 公务员 | J40: 从事国有资产监督、管理等工作。 | K40: 不限 | L40: 35 | M40: 不限 | N40: 大学本科及以上 | O40: 学士及以上 | P40: 应用经济学(A0202),机械工程(A0802),计算机科学与技术(A0812),管理科学与工程(A1201),工商管理(A1202) | Q40: 经济学类(B0201),财政学类(B0202),金融学类(B0203),统计学类(B0711),机械类(B0802),计算机类(B0809),管理科学与工程类(B1201),工商管理类(B1202) | R40: 否 | S40: 无。 | T40: 否 | U40: 《行政职业能力测验》,《申论》（Ⅰ类）。
A41: 202201HL192 | B41: 1 | C41: 470 | D41: =C41/B41 -> 470 | E41: 市区机关职位 | F41: 深圳市坪山区群团工作部 | G41: 行政管理 | H41: 一级科员 | I41: 公务员 | J41: 从事行政事务、人事党务、纪检监察等工作。 | K41: 不限 | L41: 35 | M41: 不限 | N41: 大学本科及以上 | O41: 学士及以上 | P41: 哲学(A01),经济学(A02),法学(A03),教育学(A04),文学(A05),历史学(A06),理学(A07),工学(A08),农学(A09),医学(A10),管理学(A12) | Q41: 哲学(B01),经济学(B02),法学(B03),教育学(B04),文学(B05),历史学(B06),理学(B07),工学(B08),农学(B09),医学(B10),管理学(B12) | R41: 否 | S41: 无 | T41: 否 | U41: 《行政职业能力测验》,《申论》（Ⅰ类）。
A42: 202201HL193 | B42: 1 | C42: 408 | D42: =C42/B42 -> 408 | E42: 市区机关职位 | F42: 深圳市光明区发展和改革局 | G42: 政策研究 | H42: 二级主任科员及以下 | I42: 公务员 | J42: 从事发展规划、政策研究、项目审批等相关工作。 | K42: 不限 | L42: 35 | M42: 不限 | N42: 大学本科及以上 | O42: 学士及以上 | P42: 经济学(A02),法学(A0301),土木工程(A0814),管理学(A12) | Q42: 经济学(B02),法学类(B0301),土木类(B0811),管理学(B12) | R42: 否 | S42: 无 | T42: 否 | U42: 《行政职业能力测验》,《申论》（Ⅰ类）。
A43: 202201HL194 | B43: 1 | C43: 210 | D43: =C43/B43 -> 210 | E43: 市区机关职位 | F43: 深圳市光明区科技创新局 | G43: 政策研究 | H43: 四级主任科员 | I43: 公务员 | J43: 从事科技领域政策研究、科技服务、项目管理等工作。 | K43: 不限 | L43: 35 | M43: 不限 | N43: 硕士研究生及以上 | O43: 硕士及以上 | P43: 应用经济学(A0202),物理学(A0702),化学(A0703),机械工程(A0802),材料科学与工程(A0805),电子科学与技术(A0809),信息与通信工程(A0810),计算机科学与技术(A0812),软件工程(A0835) | R43: 否 | S43: 无 | T43: 否 | U43: 《行政职业能力测验》,《申论》（Ⅰ类）。
A44: 202201HL195 | B44: 1 | C44: 19 | D44: =C44/B44 -> 19 | E44: 市区机关职位 | F44: 深圳市光明区人力资源局 | G44: 劳动人事争议仲裁 | H44: 一级科员 | I44: 公务员 | J44: 从事劳动人事争议仲裁调解、审理、裁决等工作。 | K44: 不限 | L44: 35 | M44: 不限 | N44: 大学本科及以上 | O44: 学士及以上 | P44: 法学(A0301) | Q44: 法学类(B0301) | R44: 否 | S44: 通过法律职业资格考试（国家司法考试）并取得A类证书。 | T44: 否 | U44: 《行政职业能力测验》,《申论》（Ⅰ类）。
A45: 202201HL198 | B45: 1 | C45: 267 | D45: =C45/B45 -> 267 | E45: 市区机关职位 | F45: 中共深圳市大鹏新区纪律检查工作委员会 | G45: 信息化审计 | H45: 一级科员 | I45: 公务员 | J45: 从事经济责任审计、财政财务审计、大数据审计、信息化审计等工作。 | K45: 不限 | L45: 35 | M45: 不限 | N45: 大学本科及以上 | O45: 学士及以上 | P45: 审计硕士（专业硕士）(A020218),信息与通信工程(A0810),控制科学与工程(A0811),计算机科学与技术(A0812),会计学(A120201),企业管理（含：财务管理、市场营销、人力资源管理）(A120202),会计硕士（专业硕士）(A120206) | Q45: 电子信息类(B0807),自动化类(B0808),计算机类(B0809),会计学(B120203),财务管理(B120204),审计学(B120207) | R45: 否 | S45: 无 | T45: 否 | U45: 《行政职业能力测验》,《申论》（Ⅰ类）。 | V45: 专业要求为企业管理(A120202)的，仅限财务管理方向。
A46: 202201HL205 | B46: 1 | C46: 400 | D46: =C46/B46 -> 400 | E46: 市区机关职位 | F46: 深圳市深汕特别合作区科技创新和经济服务局 | G46: 经贸服务与政策研究 | H46: 一级科员 | I46: 公务员 | J46: 从事贸易及其他服务业管理、政策研究和项目管理等相关工作。 | K46: 不限 | L46: 35 | M46: 不限 | N46: 大学本科及以上 | O46: 学士及以上 | P46: 理论经济学(A0201),应用经济学(A0202),法学(A0301),计算机科学与技术(A0812),管理科学与工程(A1201),工商管理(A1202),公共管理(A1204) | Q46: 经济学类(B0201),经济与贸易类(B0204),法学类(B0301),计算机类(B0809),管理科学与工程类(B1201),工商管理类(B1202),公共管理类(B1204),电子商务类(B1208) | R46: 否 | S46: 无 | T46: 否 | U46: 《行政职业能力测验》,《申论》（Ⅰ类）。
A47: 202201JL006 | B47: 1 | C47: 11 | D47: =C47/B47 -> 11 | E47: 市区机关职位 | F47: 深圳市龙岗区城市管理监督指挥中心 | G47: 行政综合 | H47: 一级行政执法员 | I47: 参照公务员法管理人员 | J47: 从事行政事务、人事党务、综合调研等工作。 | K47: 不限 | L47: 35 | M47: 不限 | N47: 大学本科及以上 | O47: 学士及以上 | P47: 法学(A0301),中国语言文学(A0501) | Q47: 法学类(B0301),中国语言文学类(B0501) | R47: 否 | S47: 无 | T47: 否 | U47: 《行政职业能力测验》,《申论》（Ⅱ类）。
A48: 202201KL007 | B48: 1 | C48: 105 | D48: =C48/B48 -> 105 | E48: 基层一线职位 | F48: 深圳市规划和自然资源局龙华管理局 | G48: 行政综合 | H48: 一级科员 | I48: 公务员 | J48: 从事行政事务、人事党务、纪检监察、综合调研等工作。 | K48: 不限 | L48: 35 | M48: 不限 | N48: 大学本科及以上 | O48: 学士及以上 | P48: 审计硕士（专业硕士）(A020218),新闻传播学(A0503),企业管理（含：财务管理、市场营销、人力资源管理）(A120202),社会保障(A120404) | Q48: 新闻传播学类(B0503),财务管理(B120204),审计学(B120207),劳动与社会保障(B120403) | R48: 否 | S48: 无 | T48: 是 | U48: 《行政职业能力测验》,《申论》（Ⅰ类）。 | V48: 专业要求为企业管理(A120202)的，仅限财务管理方向。
A49: 202201KL014 | B49: 1 | C49: 22 | D49: =C49/B49 -> 22 | E49: 基层一线职位 | F49: 深圳市盐田区司法局 | G49: 法律事务 | H49: 一级科员 | I49: 公务员 | J49: 从事法律法规研究、开展依法行政等工作。 | K49: 不限 | L49: 35 | M49: 不限 | N49: 大学本科及以上 | O49: 学士及以上 | P49: 宪法学与行政法学(A030103),民商法学（含：劳动法学、社会保障法学）(A030105),诉讼法学(A030106),经济法学(A030107),法律硕士（专业硕士）(A030111) | Q49: 法学(B030101) | R49: 否 | S49: 通过法律职业资格考试（国家司法考试）并取得A类证书。 | T49: 否 | U49: 《行政职业能力测验》,《申论》（Ⅰ类）。
A50: 202201KL016 | B50: 1 | C50: 59 | D50: =C50/B50 -> 59 | E50: 基层一线职位 | F50: 深圳市盐田区机关事务管理局 | G50: 行政综合 | H50: 四级主任科员及以下 | I50: 参照公务员法管理人员 | J50: 从事行政事务、公务接待等工作。 | K50: 不限 | L50: 35 | M50: 不限 | N50: 大学本科及以上 | O50: 学士及以上 | P50: 法学(A0301),中国语言文学(A0501),公共管理(A1204) | Q50: 法学类(B0301),中国语言文学类(B0501),公共管理类(B1204) | R50: 否 | S50: 无 | T50: 否 | U50: 《行政职业能力测验》,《申论》（Ⅰ类）。
A51: 202201KL017 | B51: 1 | C51: 12 | D51: =C51/B51 -> 12 | E51: 基层一线职位 | F51: 深圳市大鹏新区政法办公室 | G51: 法律事务 | H51: 一级科员 | I51: 公务员 | J51: 从事法律法规研究、开展依法行政等工作。 | K51: 不限 | L51: 35 | M51: 不限 | N51: 大学本科及以上 | O51: 学士及以上 | P51: 法学(A0301) | Q51: 法学类(B0301) | R51: 否 | S51: 通过法律职业资格考试（国家司法考试）并取得A类证书。 | T51: 否 | U51: 《行政职业能力测验》,《申论》（Ⅰ类）。
A52: 202201KL019 | B52: 1 | C52: 133 | D52: =C52/B52 -> 133 | E52: 基层一线职位 | F52: 深圳市大鹏新区应急管理局 | G52: 应急管理 | H52: 一级科员 | I52: 公务员 | J52: 从事应急管理、抢险救援等相关工作。 | K52: 不限 | L52: 35 | M52: 不限 | N52: 大学本科及以上 | O52: 学士及以上 | P52: 经济学(A02),法学(A03),文学(A05),工学(A08),管理学(A12) | Q52: 经济学(B02),法学(B03),文学(B05),工学(B08),管理学(B12) | R52: 否 | S52: 无 | T52: 否 | U52: 《行政职业能力测验》,《申论》（Ⅰ类）。
A53: 202201LG001 | B53: 1 | C53: 54 | D53: =C53/B53 -> 54 | E53: 基层一线职位 | F53: 深圳市市场监督管理局福田监管局 | G53: 财务会计审计 | H53: 一级行政执法员 | I53: 公务员 | J53: 从事财务管理、会计核算、财务审计、预决算编制等工作。 | K53: 不限 | L53: 35 | M53: 不限 | N53: 大学本科及以上 | O53: 学士及以上 | P53: 财政学（含∶税收学）(A020203),审计硕士（专业硕士）(A020218),会计学(A120201),企业管理（含：财务管理、市场营销、人力资源管理）(A120202),会计硕士（专业硕士）(A120206) | Q53: 财政学类(B0202),会计学(B120203),财务管理(B120204),审计学(B120207) | R53: 否 | S53: 具有会计专业初级以上专业技术资格证书。 | T53: 否 | U53: 《行政职业能力测验》,《申论》（Ⅱ类）,《财务会计素质测试》。 | V53: 专业要求为企业管理(A120202)的，仅限财务管理方向。
A54: 202201LJ011 | B54: 1 | C54: 140 | D54: =C54/B54 -> 140 | E54: 基层一线职位 | F54: 广东省深圳监狱 | G54: 狱政管理 | H54: 二级警长及以下 | I54: 公务员 | J54: 从事男子监狱狱政管理及一线值班备勤工作。 | K54: 不限 | L54: 30 | M54: 不限 | N54: 大学本科及以上 | O54: 学士及以上 | R54: 否 | S54: 无 | T54: 是 | U54: 《行政职业能力测验》,《申论》（Ⅱ类）,《司法素质测试》。
A55: 202201LK007 | B55: 1 | C55: 6 | D55: =C55/B55 -> 6 | E55: 基层一线职位 | F55: 深圳市交通运输行政执法支队 | G55: 法律事务 | H55: 一级行政执法员 | I55: 公务员 | J55: 从事法律法规研究、开展依法行政等工作。 | K55: 不限 | L55: 35 | M55: 不限 | N55: 大学本科及以上 | O55: 学士及以上 | P55: 宪法学与行政法学(A030103),诉讼法学(A030106) | Q55: 法学(B030101) | R55: 否 | S55: 通过法律职业资格考试（国家司法考试）并取得A类证书。 | T55: 否 | U55: 《行政职业能力测验》,《申论》（Ⅱ类）,《行政执法素质测试》。
A56: 202201LK068 | B56: 1 | C56: 1 | D56: =C56/B56 -> 1 | E56: 基层一线职位 | F56: 深圳市福田区劳动监察大队 | G56: 法律事务 | H56: 一级行政执法员 | I56: 公务员 | J56: 从事法律法规研究、开展依法行政等工作。 | K56: 不限 | L56: 35 | M56: 不限 | N56: 大学本科及以上 | O56: 学士及以上 | P56: 法学理论(A030101),宪法学与行政法学(A030103),民商法学（含：劳动法学、社会保障法学）(A030105),法律硕士（专业硕士）(A030111) | Q56: 法学(B030101) | R56: 否 | S56: 通过法律职业资格考试（国家司法考试）并取得A类证书。 | T56: 是 | U56: 《行政职业能力测验》,《申论》（Ⅱ类）,《行政执法素质测试》。
A57: 202201LK078 | B57: 2 | C57: 12 | D57: =C57/B57 -> 6 | E57: 基层一线职位 | F57: 深圳市罗湖区清水河街道办事处 | G57: 城管执法 | H57: 四级主办及以下 | I57: 公务员 | J57: 从事城市管理、一线执法等工作。 | K57: 不限 | L57: 35 | M57: 不限 | N57: 大学本科及以上 | O57: 学士及以上 | P57: 法学(A0301) | Q57: 法学类(B0301) | R57: 否 | S57: 通过法律职业资格考试（国家司法考试）并取得A类证书。 | T57: 是 | U57: 《行政职业能力测验》,《申论》（Ⅱ类）,《行政执法素质测试》。
A58: 202201LK085 | B58: 1 | C58: 7 | D58: =C58/B58 -> 7 | E58: 基层一线职位 | F58: 深圳市南山区南头街道办事处 | G58: 法律事务 | H58: 一级行政执法员 | I58: 公务员 | J58: 从事法律法规研究、开展依法行政等工作。 | K58: 不限 | L58: 35 | M58: 不限 | N58: 大学本科及以上 | O58: 学士及以上 | P58: 法学理论(A030101),宪法学与行政法学(A030103),民商法学（含：劳动法学、社会保障法学）(A030105),诉讼法学(A030106),经济法学(A030107),环境与资源保护法学(A030108),国际法学（含：国际公法、国际私法、国际经济法）(A030109),法律硕士（专业硕士）(A030111) | Q58: 法学类(B0301) | R58: 否 | S58: 通过法律职业资格考试（国家司法考试）并取得A类证书。 | T58: 是 | U58: 《行政职业能力测验》,《申论》（Ⅱ类）,《行政执法素质测试》。
A59: 202201LK087 | B59: 1 | C59: 3 | D59: =C59/B59 -> 3 | E59: 基层一线职位 | F59: 深圳市南山区南山街道综合行政执法办公室 | G59: 行政执法 | H59: 一级行政执法员 | I59: 公务员 | J59: 从事执法队案件执法等工作。 | K59: 不限 | L59: 35 | M59: 不限 | N59: 大学本科及以上 | O59: 学士及以上 | P59: 法学(A0301) | Q59: 法学类(B0301) | R59: 否 | S59: 通过法律职业资格考试（国家司法考试）并取得A类证书。 | T59: 是 | U59: 《行政职业能力测验》,《申论》（Ⅱ类）,《行政执法素质测试》。
A60: 202201LK104 | B60: 1 | C60: 5 | D60: =C60/B60 -> 5 | E60: 基层一线职位 | F60: 深圳市宝安区航城街道综合行政执法办公室 | G60: 综合执法 | H60: 一级行政执法员 | I60: 公务员 | J60: 从事法律法规研究、开展依法行政等工作。 | K60: 不限 | L60: 35 | M60: 不限 | N60: 大学本科及以上 | O60: 学士及以上 | P60: 法学(A0301) | Q60: 法学类(B0301) | R60: 否 | S60: 通过法律职业资格考试（国家司法考试）并取得A类证书。 | T60: 否 | U60: 《行政职业能力测验》,《申论》（Ⅱ类）,《行政执法素质测试》。
A61: 202201LK117 | B61: 1 | C61: 6 | D61: =C61/B61 -> 6 | E61: 基层一线职位 | F61: 深圳市龙岗区布吉街道综合行政执法办公室 | G61: 行政执法 | H61: 一级行政执法员 | I61: 公务员 | J61: 从事依法行政、案件审查工作。 | K61: 不限 | L61: 35 | M61: 不限 | N61: 大学本科及以上 | O61: 学士及以上 | P61: 法学(A0301) | Q61: 法学类(B0301) | R61: 否 | S61: 通过法律职业资格考试（国家司法考试）并取得A类证书。 | T61: 否 | U61: 《行政职业能力测验》,《申论》（Ⅱ类）,《行政执法素质测试》。
A62: 202201LK128 | B62: 1 | C62: 11 | D62: =C62/B62 -> 11 | E62: 基层一线职位 | F62: 深圳市龙岗区劳动监察大队 | G62: 法律事务 | H62: 一级行政执法员 | I62: 公务员 | J62: 从事法制宣传、案件审查等工作。 | K62: 不限 | L62: 35 | M62: 不限 | N62: 大学本科 | O62: 学士 | Q62: 法学类(B0301) | R62: 否 | S62: 通过法律职业资格考试（国家司法考试）并取得A类证书。 | T62: 否 | U62: 《行政职业能力测验》,《申论》（Ⅱ类）,《行政执法素质测试》。
A63: 202201LK165 | B63: 1 | C63: 0 | D63: =C63/B63 -> 0 | E63: 基层一线职位 | F63: 深圳市大鹏新区规划土地监察局 | G63: 规划土地监察 | H63: 一级行政执法员 | I63: 公务员 | J63: 从事规划土地监察、临时用地临时建筑审批等工作。 | K63: 不限 | L63: 35 | M63: 不限 | N63: 大学本科及以上 | O63: 学士及以上 | P63: 法学理论(A030101),宪法学与行政法学(A030103),诉讼法学(A030106),中国语言文学(A0501) | Q63: 法学(B030101),中国语言文学类(B0501) | R63: 否 | S63: 无 | T63: 否 | U63: 《行政职业能力测验》,《申论》（Ⅱ类）,《行政执法素质测试》。
A64: 202201LL016 | B64: 1 | C64: 35 | D64: =C64/B64 -> 35 | E64: 基层一线职位 | F64: 深圳市龙岗区吉华街道综合行政执法办公室 | G64: 纪检监察 | H64: 二级主办及以下 | I64: 公务员 | J64: 从事纪检监察，案件审查等工作。 | K64: 不限 | L64: 35 | M64: 不限 | N64: 大学本科及以上 | O64: 学士及以上 | P64: 法学(A03) | Q64: 法学(B03) | R64: 否 | S64: 无 | T64: 否 | U64: 《行政职业能力测验》,《申论》（Ⅱ类）。
A65: 202201LL020 | B65: 2 | C65: 34 | D65: =C65/B65 -> 17 | E65: 基层一线职位 | F65: 深圳市龙岗区园山街道综合行政执法办公室 | G65: 行政综合 | H65: 四级主办及以下 | I65: 公务员 | J65: 从事行政事务、人事党务、纪检监察、综合调研等工作。 | K65: 不限 | L65: 35 | M65: 不限 | N65: 大学本科及以上 | O65: 学士及以上 | P65: 哲学(A0101),法学(A0301),中国语言文学(A0501),新闻传播学(A0503) | Q65: 哲学类(B0101),法学类(B0301),中国语言文学类(B0501),新闻传播学类(B0503) | R65: 否 | S65: 无 | T65: 否 | U65: 《行政职业能力测验》,《申论》（Ⅱ类）。
A66: 202201LS001 | B66: 1 | C66: 46 | D66: =C66/B66 -> 46 | E66: 基层一线职位 | F66: 深圳市宝安区燕罗街道办事处 | G66: 审计事务 | H66: 一级科员 | I66: 公务员 | J66: 从事财政财务审计、预算执行审计等工作。 | K66: 不限 | L66: 35 | M66: 不限 | N66: 大学本科及以上 | O66: 学士及以上 | P66: 应用经济学(A0202),会计学(A120201),会计硕士（专业硕士）(A120206) | Q66: 经济学类(B0201),会计学(B120203),审计学(B120207) | R66: 否 | S66: 无 | T66: 否 | U66: 《行政职业能力测验》,《申论》（Ⅱ类）,《审计素质测试》。
A67: 202201LT001 | B67: 1 | C67: 53 | D67: =C67/B67 -> 53 | E67: 基层一线职位 | F67: 深圳市罗湖区东门街道办事处 | G67: 财务会计 | H67: 四级主任科员及以下 | I67: 公务员 | J67: 从事财务管理、会计核算、财务审计、预决算编制管理、固定资产管理等工作。 | K67: 不限 | L67: 35 | M67: 不限 | N67: 大学本科及以上 | O67: 学士及以上 | P67: 应用经济学(A0202),会计学(A120201),会计硕士（专业硕士）(A120206) | Q67: 财政学类(B0202),会计学(B120203),审计学(B120207) | R67: 否 | S67: 无 | T67: 是 | U67: 《行政职业能力测验》,《申论》（Ⅱ类）,《财务会计素质测试》。
A68: 202201LT004 | B68: 1 | C68: 29 | D68: =C68/B68 -> 29 | E68: 基层一线职位 | F68: 深圳市龙华区龙华街道办事处 | G68: 财务会计审计 | H68: 一级科员 | I68: 公务员 | J68: 从事财务管理、会计核算、财务审计、预决算编制管理、固定资产管理等工作。 | K68: 不限 | L68: 35 | M68: 不限 | N68: 大学本科及以上 | O68: 学士及以上 | P68: 应用经济学(A0202),工商管理(A1202) | Q68: 财政学类(B0202),工商管理类(B1202) | R68: 否 | S68: 无 | T68: 是 | U68: 《行政职业能力测验》,《申论》（Ⅱ类）,《财务会计素质测试》。
A69: 202201LT005 | B69: 1 | C69: 54 | D69: =C69/B69 -> 54 | E69: 基层一线职位 | F69: 深圳市龙华区大浪街道办事处 | G69: 财务会计审计 | H69: 一级科员 | I69: 公务员 | J69: 从事财务管理、会计核算、财务审计、预决算编制管理、固定资产管理等工作。 | K69: 不限 | L69: 35 | M69: 不限 | N69: 大学本科及以上 | O69: 学士及以上 | P69: 应用经济学(A0202),工商管理(A1202) | Q69: 财政学类(B0202),工商管理类(B1202) | R69: 否 | S69: 无 | T69: 是 | U69: 《行政职业能力测验》,《申论》（Ⅱ类）,《财务会计素质测试》。
A70: 202201LT006 | B70: 1 | C70: 33 | D70: =C70/B70 -> 33 | E70: 基层一线职位 | F70: 深圳市龙华区观澜街道资产和财务管理办公室 | G70: 财务会计审计 | H70: 一级科员 | I70: 参照公务员法管理人员 | J70: 从事财务管理、会计核算、财务审计、预算编制管理、固定资产管理等工作。 | K70: 不限 | L70: 35 | M70: 不限 | N70: 大学本科及以上 | O70: 学士及以上 | P70: 财政学（含∶税收学）(A020203),审计硕士（专业硕士）(A020218),会计学(A120201),企业管理（含：财务管理、市场营销、人力资源管理）(A120202),会计硕士（专业硕士）(A120206) | Q70: 财政学(B020201),会计学(B120203),财务管理(B120204),审计学(B120207) | R70: 否 | S70: 无 | T70: 是 | U70: 《行政职业能力测验》,《申论》（Ⅱ类）,《财务会计素质测试》。 | V70: 专业要求为企业管理(A120202)的，仅限财务管理方向。
A71: 202201LU001 | B71: 2 | C71: 469 | D71: =C71/B71 -> 234.5 | E71: 基层一线职位 | F71: 深圳市福田区园岭街道社区法治办公室（综治办） | G71: 行政综合 | H71: 四级主任科员及以下 | I71: 参照公务员法管理人员 | J71: 从事行政事务、综合调研等工作。 | K71: 不限 | L71: 35 | M71: 不限 | N71: 大学本科及以上 | O71: 学士及以上 | P71: 应用经济学(A0202),中国语言文学(A0501),外国语言文学(A0502) | Q71: 经济学类(B0201),中国语言文学类(B0501),外国语言文学类(B0502) | R71: 否 | S71: 无 | T71: 是 | U71: 《行政职业能力测验》,《申论》（Ⅱ类）。
A72: 202201LU004 | B72: 1 | C72: 4 | D72: =C72/B72 -> 4 | E72: 基层一线职位 | F72: 深圳市福田区南园街道社区法治办公室（综治办） | G72: 法律事务 | H72: 四级主任科员及以下 | I72: 参照公务员法管理人员 | J72: 从事基层法治、开展依法行政等工作。 | K72: 不限 | L72: 35 | M72: 不限 | N72: 大学本科及以上 | O72: 学士及以上 | P72: 法学(A03) | Q72: 法学(B03) | R72: 否 | S72: 通过法律职业资格考试（国家司法考试）并取得A类证书。 | T72: 是 | U72: 《行政职业能力测验》,《申论》（Ⅱ类）。
A73: 202201LU008 | B73: 1 | C73: 24 | D73: =C73/B73 -> 24 | E73: 基层一线职位 | F73: 深圳市福田区梅林街道办事处 | G73: 法律事务 | H73: 一级科员 | I73: 公务员 | J73: 从事法律法规研究、开展依法行政等工作。 | K73: 不限 | L73: 35 | M73: 不限 | N73: 大学本科及以上 | O73: 学士及以上 | P73: 法学(A0301) | Q73: 法学类(B0301) | R73: 否 | S73: 无 | T73: 是 | U73: 《行政职业能力测验》,《申论》（Ⅱ类）。
A74: 202201LU009 | B74: 1 | C74: 170 | D74: =C74/B74 -> 170 | E74: 基层一线职位 | F74: 深圳市福田区华富街道办事处 | G74: 行政综合 | H74: 四级主任科员及以下 | I74: 公务员 | J74: 从事一线行政事务、人事党务、综合调研等工作。 | K74: 不限 | L74: 35 | M74: 不限 | N74: 大学本科及以上 | O74: 学士及以上 | P74: 法学(A0301),政治学(A0302),中国语言文学(A0501),新闻传播学(A0503),管理学(A12) | Q74: 法学类(B0301),政治学类(B0302),中国语言文学类(B0501),新闻传播学类(B0503),管理学(B12) | R74: 否 | S74: 无 | T74: 是 | U74: 《行政职业能力测验》,《申论》（Ⅱ类）。
A75: 202201LU011 | B75: 1 | C75: 49 | D75: =C75/B75 -> 49 | E75: 基层一线职位 | F75: 深圳市福田区华富街道办事处 | G75: 行政综合 | H75: 四级主任科员及以下 | I75: 公务员 | J75: 从事党政材料撰写、综合协调等工作。 | K75: 不限 | L75: 35 | M75: 不限 | N75: 大学本科及以上 | O75: 学士及以上 | P75: 法学(A0301),政治学(A0302),中国语言文学(A0501),新闻传播学(A0503),公共管理(A1204) | Q75: 法学类(B0301),政治学类(B0302),中国语言文学类(B0501),新闻传播学类(B0503),公共管理类(B1204) | R75: 否 | S75: 无 | T75: 是 | U75: 《行政职业能力测验》,《申论》（Ⅱ类）。
A76: 202201LU016 | B76: 1 | C76: 301 | D76: =C76/B76 -> 301 | E76: 基层一线职位 | F76: 深圳市福田区香蜜湖街道办事处 | G76: 城市管理 | H76: 一级科员 | I76: 公务员 | J76: 从事城市管理等工作。 | K76: 不限 | L76: 35 | M76: 不限 | N76: 大学本科及以上 | O76: 学士及以上 | R76: 否 | S76: 无 | T76: 是 | U76: 《行政职业能力测验》,《申论》（Ⅱ类）。
A77: 202201LU017 | B77: 1 | C77: 16 | D77: =C77/B77 -> 16 | E77: 基层一线职位 | F77: 深圳市福田区莲花街道办事处 | G77: 法律事务 | H77: 一级科员 | I77: 公务员 | J77: 从事法律法规研究、开展依法行政等工作。 | K77: 不限 | L77: 35 | M77: 不限 | N77: 大学本科及以上 | O77: 学士及以上 | P77: 法学(A0301) | Q77: 法学类(B0301) | R77: 否 | S77: 无 | T77: 是 | U77: 《行政职业能力测验》,《申论》（Ⅱ类）。
A78: 202201LU020 | B78: 1 | C78: 9 | D78: =C78/B78 -> 9 | E78: 基层一线职位 | F78: 深圳市福田区福保街道办事处 | G78: 综合治理 | H78: 一级科员 | I78: 公务员 | J78: 从事社会治安综合治理工作。 | K78: 不限 | L78: 35 | M78: 不限 | N78: 大学本科及以上 | O78: 学士及以上 | P78: 法学(A0301) | Q78: 法学类(B0301) | R78: 否 | S78: 无 | T78: 是 | U78: 《行政职业能力测验》,《申论》（Ⅱ类）。
A79: 202201LU028 | B79: 1 | C79: 12 | D79: =C79/B79 -> 12 | E79: 基层一线职位 | F79: 深圳市罗湖区东湖街道办事处 | G79: 城市建设 | H79: 一级科员 | I79: 公务员 | J79: 从事基建工程、城市更新、棚户区改造、土地整备等相关领域法律事务工作。 | K79: 不限 | L79: 35 | M79: 不限 | N79: 大学本科及以上 | O79: 学士及以上 | P79: 法学(A0301) | Q79: 法学类(B0301) | R79: 否 | S79: 无 | T79: 是 | U79: 《行政职业能力测验》,《申论》（Ⅱ类）。
A80: 202201LU040 | B80: 1 | C80: 9 | D80: =C80/B80 -> 9 | E80: 基层一线职位 | F80: 深圳市南山区西丽街道办事处 | G80: 法治建设 | H80: 一级科员 | I80: 公务员 | J80: 从事法律服务、普法宣传、法治政府建设等工作。 | K80: 不限 | L80: 35 | M80: 不限 | N80: 大学本科及以上 | O80: 学士及以上 | P80: 法学(A0301),公安学(A0306) | Q80: 法学类(B0301),公安学类(B0306) | R80: 否 | S80: 无 | T80: 是 | U80: 《行政职业能力测验》,《申论》（Ⅱ类）。
A81: 202201LU053 | B81: 1 | C81: 24 | D81: =C81/B81 -> 24 | E81: 基层一线职位 | F81: 深圳市盐田区沙头角街道办事处 | G81: 行政综合 | H81: 一级科员 | I81: 公务员 | J81: 从事行政事务、纪检监察、综合调研等工作。 | K81: 不限 | L81: 35 | M81: 不限 | N81: 大学本科及以上 | O81: 学士及以上 | P81: 法学(A0301),中国语言文学(A0501),新闻传播学(A0503) | Q81: 法学类(B0301),中国语言文学类(B0501),新闻传播学类(B0503) | R81: 否 | S81: 无 | T81: 否 | U81: 《行政职业能力测验》,《申论》（Ⅱ类）。
A82: 202201LU060 | B82: 1 | C82: 179 | D82: =C82/B82 -> 179 | E82: 基层一线职位 | F82: 深圳市盐田区梅沙街道办事处 | G82: 行政综合 | H82: 一级科员 | I82: 公务员 | J82: 从事行政事务、人事党务、开展街道公共文明建设、精神文明建设、思想政治、意识形态、文化体育等工作。 | K82: 不限 | L82: 35 | M82: 不限 | N82: 大学本科及以上 | O82: 学士及以上 | P82: 哲学(A01),文学(A05),历史学(A06),工学(A08),管理学(A12) | Q82: 哲学(B01),文学(B05),历史学(B06),工学(B08),管理学(B12) | R82: 否 | S82: 无 | T82: 否 | U82: 《行政职业能力测验》,《申论》（Ⅱ类）。
A83: 202201LU073 | B83: 1 | C83: 21 | D83: =C83/B83 -> 21 | E83: 基层一线职位 | F83: 深圳市宝安区松岗街道办事处 | G83: 行政管理 | H83: 一级科员 | I83: 公务员 | J83: 从事行政事务、人事党务、综合调研、材料撰写等工作。 | K83: 不限 | L83: 35 | M83: 不限 | N83: 大学本科及以上 | O83: 学士及以上 | P83: 法学(A0301),中国语言文学(A0501) | Q83: 法学类(B0301),中国语言文学类(B0501) | R83: 否 | S83: 无 | T83: 否 | U83: 《行政职业能力测验》,《申论》（Ⅱ类）。
A84: 202201LU076 | B84: 1 | C84: 134 | D84: =C84/B84 -> 134 | E84: 基层一线职位 | F84: 深圳市宝安区燕罗街道办事处 | G84: 安全监察 | H84: 一级科员 | I84: 公务员 | J84: 从事企业安全生产监督管理等工作。 | K84: 不限 | L84: 35 | M84: 不限 | N84: 大学本科及以上 | O84: 学士及以上 | P84: 法学(A0301),机械工程(A0802),化学工程与技术(A0817),安全科学与工程(A0837) | Q84: 法学类(B0301),机械类(B0802),化工与制药类(B0814),安全科学与工程类(B0830) | R84: 否 | S84: 无 | T84: 否 | U84: 《行政职业能力测验》,《申论》（Ⅱ类）。
A85: 202201LU083 | B85: 1 | C85: 17 | D85: =C85/B85 -> 17 | E85: 基层一线职位 | F85: 深圳市龙岗区布吉街道办事处 | G85: 司法事务 | H85: 一级科员 | I85: 公务员 | J85: 从事复议诉讼、司法调解、社区矫正人员监督管理等工作。 | K85: 不限 | L85: 35 | M85: 不限 | N85: 大学本科及以上 | O85: 学士及以上 | P85: 法学(A0301) | Q85: 法学类(B0301) | R85: 否 | S85: 通过法律职业资格考试（国家司法考试）并取得A类证书。 | T85: 否 | U85: 《行政职业能力测验》,《申论》（Ⅱ类）。
A86: 202201LU085 | B86: 1 | C86: 17 | D86: =C86/B86 -> 17 | E86: 基层一线职位 | F86: 深圳市龙岗区宝龙街道办事处 | G86: 法律事务 | H86: 一级科员 | I86: 公务员 | J86: 从事普法和法制宣传教育、开展依法行政等工作。 | K86: 不限 | L86: 35 | M86: 不限 | N86: 大学本科及以上 | O86: 学士及以上 | P86: 法学(A03) | Q86: 法学(B03) | R86: 否 | S86: 通过法律职业资格考试（国家司法考试）并取得A类证书。 | T86: 否 | U86: 《行政职业能力测验》,《申论》（Ⅱ类）。
A87: 202201LU086 | B87: 1 | C87: 183 | D87: =C87/B87 -> 183 | E87: 基层一线职位 | F87: 深圳市龙岗区坪地街道办事处 | G87: 经济服务 | H87: 一级科员 | I87: 公务员 | J87: 从事企业联络、企业服务、产业园区服务等工作。 | K87: 不限 | L87: 35 | M87: 不限 | N87: 大学本科及以上 | O87: 学士及以上 | P87: 法学(A03),文学(A05),理学(A07),工学(A08) | Q87: 法学(B03),文学(B05),理学(B07),工学(B08) | R87: 否 | S87: 无 | T87: 是 | U87: 《行政职业能力测验》,《申论》（Ⅱ类）。
A88: 202201LU091 | B88: 2 | C88: 74 | D88: =C88/B88 -> 37 | E88: 基层一线职位 | F88: 深圳市龙华区龙华街道办事处 | G88: 行政综合 | H88: 一级科员 | I88: 公务员 | J88: 从事行政事务、人事党务、纪检监察、综合调研等工作。 | K88: 不限 | L88: 35 | M88: 不限 | N88: 大学本科及以上 | O88: 学士及以上 | P88: 法学(A0301),新闻传播学(A0503) | Q88: 法学类(B0301),新闻传播学类(B0503) | R88: 否 | S88: 无 | T88: 是 | U88: 《行政职业能力测验》,《申论》（Ⅱ类）。
A89: 202201LU117 | B89: 1 | C89: 44 | D89: =C89/B89 -> 44 | E89: 基层一线职位 | F89: 深圳市光明区新湖街道办事处 | G89: 科创服务 | H89: 二级主任科员及以下 | I89: 公务员 | J89: 从事光明科学城科技创新服务、人才服务等工作。 | K89: 不限 | L89: 35 | M89: 不限 | N89: 硕士研究生及以上 | O89: 硕士及以上 | P89: 应用经济学(A0202) | R89: 否 | S89: 雅思6.5分及以上，或托福90分及以上，或GRE(含作文)达到310分及以上，或GMAT达到600分及以上，或英语专业八级考试达到60分及以上，或大学英语六级考试达到550分及以上。 | T89: 否 | U89: 《行政职业能力测验》,《申论》（Ⅱ类）。
A90: 202201LU129 | B90: 2 | C90: 181 | D90: =C90/B90 -> 90.5 | E90: 基层一线职位 | F90: 深圳市大鹏新区葵涌办事处 | G90: 党建综合 | H90: 一级科员 | I90: 公务员 | J90: 从事基层党务、组织人事、纪检监察、综合调研等工作。 | K90: 不限 | L90: 35 | M90: 不限 | N90: 大学本科及以上 | O90: 学士及以上 | P90: 应用经济学(A0202),法学(A0301),中国语言文学(A0501),新闻传播学(A0503),历史学(A0601) | Q90: 经济与贸易类(B0204),法学类(B0301),中国语言文学类(B0501),新闻传播学类(B0503),历史学类(B0601) | R90: 否 | S90: 中共党员。 | T90: 否 | U90: 《行政职业能力测验》,《申论》（Ⅱ类）。
A91: 202201LU134 | B91: 1 | C91: 209 | D91: =C91/B91 -> 209 | E91: 基层一线职位 | F91: 深圳市大鹏新区大鹏办事处 | G91: 城市建设 | H91: 一级科员 | I91: 公务员 | J91: 从事城市建设、建筑工程管理、生态环境保护等工作。 | K91: 不限 | L91: 35 | M91: 不限 | N91: 大学本科及以上 | O91: 学士及以上 | R91: 否 | S91: 无 | T91: 否 | U91: 《行政职业能力测验》,《申论》（Ⅱ类）。
A92: 202201ND001 | B92: 1 | C92: 55 | D92: =C92/B92 -> 55 | E92: 定向港澳选拔职位 | F92: 深圳市宝安区发展和改革局 | G92: 大湾区金融研究 | H92: 一级科员 | I92: 公务员 | J92: 从事相关金融产业发展规划、政策研究和项目管理等相关工作。 | K92: 不限 | L92: 35 | M92: 不限 | N92: 大学本科及以上 | O92: 学士及以上 | P92: 应用经济学(A0202) | Q92: 金融学类(B0203) | R92: 否 | S92: 无 | T92: 否 | U92: 《行政职业能力测验》,《申论》（Ⅰ类）,《金融素质测试》。